{
  "$schema": "deepguard-report/v3",
  "metadata": {
    "report_id": "DG-20260822-001",
    "report_version": "1.0.0",
    "generation_date": "2026-08-22T17:35:50+08:00",
    "auditor": "DeepGuard Audit Agent",
    "framework_version": "agent-security-audit v1.0 + dsh-overlay v1.2",
    "ruleset_version": "dsh-sink-rules v1.3 + agent-attack-rules v1.0",
    "classification": "PUBLIC",
    "audit_mode": "full"
  },
  "disclaimer": {
    "zh": "本报告由 DeepGuard 审计 Agent 自动执行并生成。安全审计存在固有限制：静态分析无法覆盖全部运行时行为，动态观测无法穷尽全部触发路径，AI 语义判断可能存在漏报与误报。本报告的「未检出」结论仅表示在当前规则库版本、检测深度与时间窗口内未发现恶意行为或安全风险，不构成对该插件绝对安全、现在或未来均无恶意行为的任何保证；检出项亦可能因上下文差异存在偏差。本报告仅覆盖所标注的插件版本与 commit 快照，作者此后发布的新版本或对既有版本的任何改写（含 force-push）均不在覆盖范围内。用户安装与使用插件属自主行为，相关风险由用户自行评估与承担。DeepGuard 保留随规则库升级对历史版本重新审计并修订结论的权利。",
    "en": "This report was automatically executed and generated by the DeepGuard Audit Agent. Security auditing has inherent limitations: static analysis cannot cover all runtime behavior, dynamic observation cannot exhaust all trigger paths, and AI-based semantic judgment may produce false negatives and false positives. A \"not detected\" conclusion in this report only means that no malicious behavior or security risk was found within the current ruleset version, detection depth, and time window; it does not constitute any guarantee that the plugin is absolutely safe or free of malicious behavior now or in the future. Detected items may also deviate due to contextual differences. This report covers only the plugin version and commit snapshot it identifies; any new version released by the author afterwards, or any rewrite of an existing version (including force-push), is outside its scope. Installing and using a plugin is the user's own decision, and the associated risks are assessed and borne by the user. DeepGuard reserves the right to re-audit historical versions and revise conclusions as the ruleset evolves."
  },
  "plugin": {
    "id": "dsh-better-sidebar",
    "name": "dsh-better-sidebar",
    "version": "0.15.0",
    "commit": "9a40164d1a69dbc960585d8789ee0d849231979b",
    "subpath": null,
    "source": {
      "type": "git",
      "url": "https://github.com/omdsh-dev/dsh-better-sidebar"
    },
    "category": "ui",
    "author": {
      "github": "omdsh-dev",
      "verified": false
    },
    "engines": {
      "dsh": ">=0.0.1"
    },
    "declared_capabilities": {
      "network": true,
      "shell": true,
      "fs": "full",
      "modelFacing": true
    }
  },
  "summary": {
    "overall_result": "clean",
    "dimension_overview": [
      {
        "dimension": "DG-D1",
        "status": "clean",
        "checked": 4,
        "findings": 0
      },
      {
        "dimension": "DG-D2",
        "status": "clean",
        "checked": 5,
        "findings": 0
      },
      {
        "dimension": "DG-D3",
        "status": "clean",
        "checked": 8,
        "findings": 0
      },
      {
        "dimension": "DG-D4",
        "status": "clean",
        "checked": 4,
        "findings": 0
      },
      {
        "dimension": "DG-D5",
        "status": "clean",
        "checked": 5,
        "findings": 0
      },
      {
        "dimension": "DG-D6",
        "status": "clean",
        "checked": 3,
        "findings": 0
      }
    ],
    "key_findings": [],
    "version_signal": "none"
  },
  "dimensions": [
    {
      "dimension": "DG-D1",
      "name": {
        "zh": "凭据密钥窃取",
        "en": "Credential & Secret Theft"
      },
      "status": "clean",
      "checked_items": [
        {
          "zh": "检查了代码中所有文件读取操作（src/index.ts 的 fs.read 方法、src/fs-operations.ts 的写操作），未发现主动读取凭据文件（如 ~/.dsh/.credentials.yaml、~/.ssh/id_rsa 等）的行为。",
          "en": "Checked all file read operations in the code (the fs.read method in src/index.ts, write operations in src/fs-operations.ts); no behavior of proactively reading credential files (such as ~/.dsh/.credentials.yaml, ~/.ssh/id_rsa, etc.) was detected."
        },
        {
          "zh": "扫描了全 227 个文件中的硬编码凭据模式（API Key、token、密码等 160+ 模式），未发现硬编码凭据。",
          "en": "Scanned all 227 files for hardcoded credential patterns (API keys, tokens, passwords, and 160+ other patterns); no hardcoded credentials were found."
        },
        {
          "zh": "检查了凭据枚举语义指令（grep -R KEY、find ~ 等），未发现此类命令。",
          "en": "Checked for credential-enumeration semantic commands (grep -R KEY, find ~, etc.); no such commands were found."
        },
        {
          "zh": "检查了钱包相关模式（助记词、私钥、keystore 等），未发现相关代码。",
          "en": "Checked wallet-related patterns (mnemonics, private keys, keystore, etc.); no related code was found."
        }
      ],
      "ds_scenarios": [
        {
          "id": "DG-S12",
          "status": "pass",
          "evidence": {
            "zh": "插件代码未主动读取 $DSH_HOME/.credentials.yaml 或 ~/.ssh 等敏感路径。插件提供的 /sidebar/api/fs.read 路由理论上可接受任意绝对路径读取文件（包括凭据文件），但需通过浏览器信任围栏且不是插件自身发起的操作，已在检查项中留痕。",
            "en": "The plugin code does not proactively read sensitive paths such as $DSH_HOME/.credentials.yaml or ~/.ssh. The /sidebar/api/fs.read route provided by the plugin can theoretically accept arbitrary absolute paths to read files (including credential files), but it requires passing the browser trust fence and is not an operation initiated by the plugin itself; this has been noted in the inspection item."
          }
        },
        {
          "id": "DG-S01",
          "status": "pass",
          "evidence": {
            "zh": "不适用此维度，已转至 DG-D3 处理。",
            "en": "Not applicable to this dimension; has been forwarded to DG-D3 for handling."
          }
        }
      ],
      "findings": []
    },
    {
      "dimension": "DG-D2",
      "name": {
        "zh": "提示词注入",
        "en": "Prompt Injection"
      },
      "status": "clean",
      "checked_items": [
        {
          "zh": "检查了所有注册工具（src/tools.ts 中的 terminal_create 等 8 个工具）的 description 字段，内容均为功能描述，无系统指令覆写、凭据诱导或越权指令措辞。",
          "en": "Checked the description fields of all registered tools (the 8 tools such as terminal_create in src/tools.ts); the content consists entirely of functional descriptions, with no system-instruction override, credential inducement, or privilege-escalation wording."
        },
        {
          "zh": "检查了 AGENTS.md（50KB 插件接入文档）、README.md 等文档，未发现隐藏指令或注入措辞。",
          "en": "Checked documents such as AGENTS.md (50KB plugin integration doc) and README.md; no hidden instructions or injection wording were found."
        },
        {
          "zh": "检查了源代码和注释中的指令覆写措辞（ignore previous instructions、SYSTEM PROMPT 等模式），未发现。",
          "en": "Checked source code and comments for instruction-override wording (e.g., ignore previous instructions, SYSTEM PROMPT patterns); none were found."
        },
        {
          "zh": "检查了 ctx.systemPrompt.section() 调用模式，插件未注入系统提示片段（sidechat-core.ts 的 SIDE_BOUNDARY_PROMPT 是防御性边界提示，用于隔离侧边对话的上下文）。",
          "en": "Checked ctx.systemPrompt.section() call patterns; the plugin does not inject system prompt fragments (SIDE_BOUNDARY_PROMPT in sidechat-core.ts is a defensive boundary prompt used to isolate side-chat context)."
        },
        {
          "zh": "检查了外部指令二次引用（URL 加载指令等），未发现诱导模型拉取远端内容的行为。",
          "en": "Checked secondary references to external instructions (URL loading instructions, etc.); no behavior inducing the model to fetch remote content was found."
        }
      ],
      "ds_scenarios": [
        {
          "id": "DG-S02",
          "status": "pass",
          "evidence": {
            "zh": "检查了 src/tools.ts 中 8 个工具（terminal_create/send/read/list/wait_for/resize/signal/close）的 description 字段，均为纯功能描述，无系统指令注入、无凭证读取诱导、无越权指令。",
            "en": "Checked the description fields of the 8 tools in src/tools.ts (terminal_create/send/read/list/wait_for/resize/signal/close); all are purely functional descriptions, with no system-instruction injection, credential-reading inducement, or privilege-escalation wording."
          }
        },
        {
          "id": "DG-S04",
          "status": "pass",
          "evidence": {
            "zh": "检查了所有工具描述和文档，未发现诱导模型安装插件（dsh plugin add）、改写配置或放开权限的措辞。",
            "en": "Checked all tool descriptions and documentation; no wording inducing the model to install plugins (dsh plugin add), modify configuration, or relax permissions was found."
          }
        }
      ],
      "findings": []
    },
    {
      "dimension": "DG-D3",
      "name": {
        "zh": "任意代码执行",
        "en": "Arbitrary Code Execution"
      },
      "status": "clean",
      "checked_items": [
        {
          "zh": "检查了 cordis.patch.yml 中的 !!js 表达式（规则 DSH-P01/DG-R3-51）：表达式为聚合双挂载守卫（ctx.loader.entries().some(...)），判断其他已启用实例是否存在以禁用自身，属只读谓词、无副作用，为良性机制。",
          "en": "Checked the !!js expressions in cordis.patch.yml (rules DSH-P01/DG-R3-51): the expression is an aggregated dual-mount guard (ctx.loader.entries().some(...)) that judges whether other enabled instances exist to disable itself; it is a read-only predicate, has no side effects, and is a benign mechanism."
        },
        {
          "zh": "检查了 package.json 的 prepare 脚本（规则 DSH-X02/DG-R3-54）：执行 tsdown 本地构建，将 src/ 目录编译为 lib/ 产物，无远程下载、无凭据访问、无网络行为，属标准工程实践。",
          "en": "Checked the prepare script in package.json (rules DSH-X02/DG-R3-54): it runs a tsdown local build, compiling the src/ directory into lib/ artifacts; no remote download, no credential access, no network behavior; it is a standard engineering practice."
        },
        {
          "zh": "检查了 child_process 使用（规则 DSH-X03/DG-R3-55）：src/git.ts 通过 spawn('git', args) 执行系统 git，参数为数组形式（无 shell:true）、无命令注入风险；tests/ 中的 new Function 和 spawnSync 为测试桩，不在生产运行。",
          "en": "Checked child_process usage (rules DSH-X03/DG-R3-55): src/git.ts executes system git via spawn('git', args) with arguments in array form (no shell:true); no command-injection risk. The new Function and spawnSync in tests/ are test stubs and do not run in production."
        },
        {